{
  "contract_version": "1.0.0",
  "run_id": "synthetic:retrieval:no-match:1",
  "query": {
    "query_ref": "synthetic-query-2",
    "query_digest": "sha256:2222222222222222222222222222222222222222222222222222222222222222",
    "raw_query_retained": false,
    "locale": "nl",
    "country_code": "BE"
  },
  "intent": {
    "status": "PARTIAL",
    "product_type": { "state": "known", "value": "coffee_machine", "evidence": [{ "evidence_type": "DETERMINISTIC_INTENT", "source_ref": "synthetic-query-2", "field": "product_type", "transformation": "synthetic_intent_parser", "transformation_version": "intent-parser/v1" }] },
    "exact_model": { "state": "unknown", "value": null, "evidence": [] },
    "brand": { "state": "unknown", "value": null, "evidence": [] },
    "hard_constraints": [],
    "soft_preferences": []
  },
  "sources": [
    { "source_type": "LEXICAL", "status": "SUCCEEDED", "candidate_count": 0, "latency_ms": 9, "index_version": "synthetic-fts/v1", "reason_code": null },
    { "source_type": "STRUCTURED", "status": "SUCCEEDED", "candidate_count": 0, "latency_ms": 4, "index_version": "synthetic-ontology/v1", "reason_code": null },
    { "source_type": "SEMANTIC", "status": "ABSTAINED", "candidate_count": 0, "latency_ms": 1, "index_version": "synthetic-vector/v1", "reason_code": "semantic_abstained" }
  ],
  "candidates": [],
  "outcome": "NO_MATCH",
  "reason_codes": ["no_match", "semantic_abstained"],
  "retrieval_version": "hybrid-retrieval/v1",
  "fusion_version": "rrf/v1",
  "evaluated_at": "2000-01-01T00:00:00Z"
}
