{
  "contract_version": "1.0.0",
  "run_id": "synthetic:retrieval:exact-product:1",
  "query": {
    "query_ref": "synthetic-query-1",
    "query_digest": "sha256:1111111111111111111111111111111111111111111111111111111111111111",
    "raw_query_retained": false,
    "locale": "fr",
    "country_code": "BE"
  },
  "intent": {
    "status": "RESOLVED",
    "product_type": {
      "state": "known",
      "value": "smartphone",
      "evidence": [{
        "evidence_type": "DETERMINISTIC_INTENT",
        "source_ref": "synthetic-query-1",
        "field": "product_type",
        "transformation": "synthetic_intent_parser",
        "transformation_version": "intent-parser/v1"
      }]
    },
    "exact_model": {
      "state": "known",
      "value": "Example Phone 15",
      "evidence": [{
        "evidence_type": "QUERY_EXPLICIT",
        "source_ref": "synthetic-query-1",
        "field": "exact_model",
        "transformation": "synthetic_exact_phrase",
        "transformation_version": "intent-parser/v1"
      }]
    },
    "brand": { "state": "unknown", "value": null, "evidence": [] },
    "hard_constraints": [],
    "soft_preferences": []
  },
  "sources": [
    { "source_type": "LEXICAL", "status": "SUCCEEDED", "candidate_count": 2, "latency_ms": 12, "index_version": "synthetic-fts/v1", "reason_code": null },
    { "source_type": "STRUCTURED", "status": "SUCCEEDED", "candidate_count": 1, "latency_ms": 7, "index_version": "synthetic-ontology/v1", "reason_code": null },
    { "source_type": "SEMANTIC", "status": "DISABLED", "candidate_count": 0, "latency_ms": 0, "index_version": null, "reason_code": "semantic_disabled" }
  ],
  "candidates": [{
    "candidate_rank": 1,
    "candidate_status": "ELIGIBLE_SHADOW",
    "entity": {
      "state": "RESOLVED",
      "entity_type": "VARIANT",
      "entity_id": 101,
      "group_key": "variant:101",
      "evidence": [{
        "evidence_type": "ENTITY_RESOLUTION",
        "source_ref": "synthetic-entity-resolution:101",
        "field": "variant_id",
        "transformation": "synthetic_entity_lookup",
        "transformation_version": "entity-resolution/v1"
      }]
    },
    "offer_ids": [1001, 1002],
    "source_hits": [
      { "source_type": "LEXICAL", "source_rank": 1, "raw_score": "8.25", "score_semantics": "synthetic_fts_rank" },
      { "source_type": "STRUCTURED", "source_rank": 1, "raw_score": null, "score_semantics": "exact_structured_match" }
    ],
    "evidence": [{
      "evidence_type": "PRODUCT_ONTOLOGY",
      "source_ref": "synthetic-ontology:101",
      "field": "product_type",
      "transformation": "synthetic_candidate_projection",
      "transformation_version": "hybrid-retrieval/v1"
    }]
  }],
  "outcome": "CANDIDATES",
  "reason_codes": ["retrieval_candidates"],
  "retrieval_version": "hybrid-retrieval/v1",
  "fusion_version": "rrf/v1",
  "evaluated_at": "2000-01-01T00:00:00Z"
}
